{
  "$schema": "https://json-schema.org/draft/2020-12/schema",
  "$id": "https://github.com/moqtap/test-vectors/schema/meta.schema.json",
  "title": "MoQT Test Vector Version Metadata",
  "description": "Per-version metadata for a specification draft or stable release.",
  "type": "object",
  "required": ["id", "spec", "spec_url", "categories"],
  "properties": {
    "$schema": {
      "type": "string"
    },
    "id": {
      "type": "string",
      "description": "Must match the directory name and the manifest entry."
    },
    "spec": {
      "type": "string",
      "description": "Full IETF document identifier."
    },
    "spec_url": {
      "type": "string",
      "format": "uri",
      "description": "URL to the specification text."
    },
    "categories": {
      "type": "array",
      "items": {
        "type": "string",
        "enum": ["codec", "catalog", "properties", "objects", "timeline"]
      },
      "description": "Which subdirectories exist. codec: wire encoding of transport messages (codec-vector.schema.json). catalog: MSF and CMSF catalog objects and their deltas (catalog-vector.schema.json). properties: LOC property values (property-vector.schema.json). objects: CMSF Object payloads read against their CMAF header (object-vector.schema.json). timeline: media and event timeline payloads, and MSF-01 media timeline templates (timeline-vector.schema.json)."
    },
    "requires": {
      "type": "object",
      "required": ["spec", "id"],
      "properties": {
        "spec": {
          "type": "string",
          "description": "A spec key in manifest.json."
        },
        "id": {
          "type": "string",
          "description": "A version id of that spec."
        }
      },
      "additionalProperties": false,
      "description": "The spec version this one extends, as its references name it (CMSF-01 extends MSF-01). Absent when that version is not included; `description` then names it."
    },
    "description": {
      "type": "string",
      "description": "Free-form notes on the version: what it extends, and anything about its text a consumer should know before running its vectors."
    }
  },
  "additionalProperties": false
}
