{
  "$schema": "../../schema/meta.schema.json",
  "id": "draft01",
  "spec": "draft-ietf-moq-loc-01",
  "spec_url": "https://www.ietf.org/archive/id/draft-ietf-moq-loc-01.txt",
  "categories": [
    "properties"
  ],
  "description": "Its [MoQTransport] is draft-ietf-moq-transport-12, whose varint is that of RFC 9000 Section 16. Wire-identical to draft-00."
}
