{
  "$schema": "../../schema/meta.schema.json",
  "id": "draft00",
  "spec": "draft-ietf-moq-loc-00",
  "spec_url": "https://www.ietf.org/archive/id/draft-ietf-moq-loc-00.txt",
  "categories": [
    "properties"
  ],
  "description": "Its [MoQTransport] is draft-ietf-moq-transport-10, whose varint is that of RFC 9000 Section 16. Frame Marking follows [Framemarking], draft-ietf-avtext-framemarking-16, whose Section 3 layouts are those of RFC 9626. Wire-identical to draft-01."
}
